[
  {
    "id": "move_A69_1",
    "name": "Evade",
    "description": "Increase evasion",
    "type": "buff",
    "target": {
      "type": "self"
    },
    "learned_at_level": 1,
    "effect_algorithm": "buff_value = (INT * 1.5) + (CRG * 0.5)"
  },
  {
    "id": "move_A69_2",
    "name": "Regenerate",
    "description": "Heal over time",
    "type": "heal",
    "target": {
      "type": "ally"
    },
    "learned_at_level": 1,
    "effect_algorithm": "healing = (MAA * 0.8) + (INT * 1.2) + (HP * 0.1)"
  },
  {
    "id": "move_A69_3",
    "name": "Endure",
    "description": "Survive fatal blows",
    "type": "buff",
    "target": {
      "type": "self"
    },
    "learned_at_level": 1,
    "effect_algorithm": "buff_value = (INT * 1.5) + (CRG * 0.5)"
  },
  {
    "id": "move_A69_4",
    "name": "Recuperate",
    "description": "Self-healing ability",
    "type": "heal",
    "target": {
      "type": "ally"
    },
    "learned_at_level": 1,
    "effect_algorithm": "healing = (MAA * 0.8) + (INT * 1.2) + (HP * 0.1)"
  }
]