[
  {
    "id": "move_A51_1",
    "name": "Backstab",
    "description": "Critical strike from behind",
    "type": "melee_attack",
    "target": {
      "type": "enemy"
    },
    "learned_at_level": 1,
    "effect_algorithm": "damage = (MLA * 1.5) + (ACC * 0.5) - (target.MLD * 0.8)",
    "target_mats": [
      {
        "tag": "water",
        "multiplier": 1.5
      },
      {
        "tag": "metallic",
        "multiplier": 1.4
      },
      {
        "tag": "earth",
        "multiplier": 0.7
      }
    ]
  },
  {
    "id": "move_A51_2",
    "name": "Poison Blade",
    "description": "Melee attack that applies poison",
    "type": "mixed",
    "target": {
      "type": "enemy"
    },
    "learned_at_level": 1,
    "effect_algorithm": "damage = (MLA * 1.2) + (MAA * 1.2) - (target.MLD * 0.5) - (target.MAD * 0.5)",
    "target_mats": [
      {
        "tag": "water",
        "multiplier": 1.5
      },
      {
        "tag": "metallic",
        "multiplier": 1.4
      },
      {
        "tag": "earth",
        "multiplier": 0.7
      }
    ]
  },
  {
    "id": "move_A51_3",
    "name": "Shadow Strike",
    "description": "Quick strike from the shadows",
    "type": "melee_attack",
    "target": {
      "type": "enemy"
    },
    "learned_at_level": 1,
    "effect_algorithm": "damage = (MLA * 1.5) + (ACC * 0.5) - (target.MLD * 0.8)",
    "target_mats": [
      {
        "tag": "water",
        "multiplier": 1.5
      },
      {
        "tag": "metallic",
        "multiplier": 1.4
      },
      {
        "tag": "earth",
        "multiplier": 0.7
      }
    ]
  },
  {
    "id": "move_A51_4",
    "name": "Vanish",
    "description": "Become invisible temporarily",
    "type": "buff",
    "target": {
      "type": "self"
    },
    "learned_at_level": 1,
    "effect_algorithm": "buff_value = (INT * 1.5) + (CRG * 0.5)"
  }
]