[
  {
    "id": "move_A61_1",
    "name": "Heavy Strike",
    "description": "Powerful melee blow",
    "type": "melee_attack",
    "target": {
      "type": "enemy"
    },
    "learned_at_level": 1,
    "effect_algorithm": "damage = (MLA * 1.5) + (ACC * 0.5) - (target.MLD * 0.8)",
    "target_mats": [
      {
        "tag": "ice",
        "multiplier": 1.5
      },
      {
        "tag": "plant",
        "multiplier": 1.3
      },
      {
        "tag": "water",
        "multiplier": 0.7
      }
    ]
  },
  {
    "id": "move_A61_2",
    "name": "Slam",
    "description": "Ground-shaking melee attack",
    "type": "melee_attack",
    "target": {
      "type": "enemy"
    },
    "learned_at_level": 1,
    "effect_algorithm": "damage = (MLA * 1.5) + (ACC * 0.5) - (target.MLD * 0.8)",
    "target_mats": [
      {
        "tag": "ice",
        "multiplier": 1.5
      },
      {
        "tag": "plant",
        "multiplier": 1.3
      },
      {
        "tag": "water",
        "multiplier": 0.7
      }
    ]
  },
  {
    "id": "move_A61_3",
    "name": "Battle Cry",
    "description": "Boosts attack power",
    "type": "buff",
    "target": {
      "type": "self"
    },
    "learned_at_level": 1,
    "effect_algorithm": "buff_value = (INT * 1.5) + (CRG * 0.5)"
  },
  {
    "id": "move_A61_4",
    "name": "Rampage",
    "description": "Flurry of melee attacks with self-buff",
    "type": "mixed",
    "target": {
      "type": "enemy"
    },
    "learned_at_level": 1,
    "effect_algorithm": "damage = (MLA * 1.2) + (MAA * 1.2) - (target.MLD * 0.5) - (target.MAD * 0.5)",
    "target_mats": [
      {
        "tag": "ice",
        "multiplier": 1.5
      },
      {
        "tag": "plant",
        "multiplier": 1.3
      },
      {
        "tag": "water",
        "multiplier": 0.7
      }
    ]
  }
]