[
  {
    "id": "move_A38_1",
    "name": "Devastating Blow",
    "description": "Massive burst damage attack",
    "type": "melee_attack",
    "target": {
      "type": "enemy"
    },
    "learned_at_level": 1,
    "effect_algorithm": "damage = (MLA * 1.5) + (ACC * 0.5) - (target.MLD * 0.8)",
    "target_mats": [
      {
        "tag": "fire",
        "multiplier": 1.5
      },
      {
        "tag": "earth",
        "multiplier": 1.2
      },
      {
        "tag": "electric",
        "multiplier": 0.6
      }
    ]
  },
  {
    "id": "move_A38_2",
    "name": "Power Strike",
    "description": "High damage single strike",
    "type": "melee_attack",
    "target": {
      "type": "enemy"
    },
    "learned_at_level": 1,
    "effect_algorithm": "damage = (MLA * 1.5) + (ACC * 0.5) - (target.MLD * 0.8)",
    "target_mats": [
      {
        "tag": "fire",
        "multiplier": 1.5
      },
      {
        "tag": "earth",
        "multiplier": 1.2
      },
      {
        "tag": "electric",
        "multiplier": 0.6
      }
    ]
  },
  {
    "id": "move_A38_3",
    "name": "Charge",
    "description": "Rushing attack with massive impact",
    "type": "melee_attack",
    "target": {
      "type": "enemy"
    },
    "learned_at_level": 1,
    "effect_algorithm": "damage = (MLA * 1.5) + (ACC * 0.5) - (target.MLD * 0.8)",
    "target_mats": [
      {
        "tag": "fire",
        "multiplier": 1.5
      },
      {
        "tag": "earth",
        "multiplier": 1.2
      },
      {
        "tag": "electric",
        "multiplier": 0.6
      }
    ]
  },
  {
    "id": "move_A38_4",
    "name": "Execute",
    "description": "Finishing move dealing extreme damage",
    "type": "melee_attack",
    "target": {
      "type": "enemy"
    },
    "learned_at_level": 1,
    "effect_algorithm": "damage = (MLA * 1.5) + (ACC * 0.5) - (target.MLD * 0.8)",
    "target_mats": [
      {
        "tag": "fire",
        "multiplier": 1.5
      },
      {
        "tag": "earth",
        "multiplier": 1.2
      },
      {
        "tag": "electric",
        "multiplier": 0.6
      }
    ]
  }
]