[
  {
    "id": "G02_Paddy_01",
    "name": "Power Strike",
    "description": "Winds up for maximum damage",
    "type": "melee_attack",
    "target": {
      "type": "enemy"
    },
    "learned_at_level": 1,
    "target_mats": [],
    "target_maecs": [],
    "effect_algorithm": "damage = (MLA * 1.00) + (ACC * 0.5) - (target.MLD * 0.7)"
  },
  {
    "id": "G02_Paddy_02",
    "name": "Devastating Blow",
    "description": "A single crushing attack",
    "type": "melee_attack",
    "target": {
      "type": "enemy"
    },
    "learned_at_level": 2,
    "target_mats": [],
    "target_maecs": [],
    "effect_algorithm": "damage = (MLA * 1.15) + (ACC * 0.5) - (target.MLD * 0.7)"
  },
  {
    "id": "G02_Paddy_03",
    "name": "Charge Up",
    "description": "Prepares for a mighty strike",
    "type": "buff",
    "target": {
      "type": "ally"
    },
    "learned_at_level": 3,
    "target_mats": [],
    "target_maecs": [],
    "effect_algorithm": "buff_value = (INT * 1.20) + (CRG * 0.5)"
  },
  {
    "id": "G02_Paddy_04",
    "name": "Seismic Slam",
    "description": "Pounds the ground with tremendous force",
    "type": "melee_attack",
    "target": {
      "type": "enemy"
    },
    "learned_at_level": 4,
    "target_mats": [],
    "target_maecs": [],
    "effect_algorithm": "damage = (MLA * 1.45) + (ACC * 0.5) - (target.MLD * 0.7)"
  },
  {
    "id": "G02_Paddy_05",
    "name": "Overwhelming Force",
    "description": "Breaks through any defense",
    "type": "melee_attack",
    "target": {
      "type": "enemy"
    },
    "learned_at_level": 5,
    "target_mats": [],
    "target_maecs": [],
    "effect_algorithm": "damage = (MLA * 1.60) + (ACC * 0.5) - (target.MLD * 0.7)"
  },
  {
    "id": "G02_Paddy_06",
    "name": "Mighty Swing",
    "description": "A wide arcing attack",
    "type": "melee_attack",
    "target": {
      "type": "enemy"
    },
    "learned_at_level": 6,
    "target_mats": [],
    "target_maecs": [],
    "effect_algorithm": "damage = (MLA * 1.75) + (ACC * 0.5) - (target.MLD * 0.7)"
  },
  {
    "id": "G02_Paddy_07",
    "name": "Thunder Strike",
    "description": "Strikes with explosive power",
    "type": "melee_attack",
    "target": {
      "type": "enemy"
    },
    "learned_at_level": 7,
    "target_mats": [],
    "target_maecs": [],
    "effect_algorithm": "damage = (MLA * 1.90) + (ACC * 0.5) - (target.MLD * 0.7)"
  },
  {
    "id": "G02_Paddy_08",
    "name": "Focus Energy",
    "description": "Concentrates all power into next attack",
    "type": "buff",
    "target": {
      "type": "ally"
    },
    "learned_at_level": 8,
    "target_mats": [],
    "target_maecs": [],
    "effect_algorithm": "buff_value = (INT * 1.70) + (CRG * 0.5)"
  },
  {
    "id": "G02_Paddy_09",
    "name": "Cataclysmic Crash",
    "description": "Brings weapon down with earth-shaking force",
    "type": "melee_attack",
    "target": {
      "type": "enemy"
    },
    "learned_at_level": 9,
    "target_mats": [],
    "target_maecs": [],
    "effect_algorithm": "damage = (MLA * 2.20) + (ACC * 0.5) - (target.MLD * 0.7)"
  },
  {
    "id": "G02_Paddy_10",
    "name": "Titan Blow",
    "description": "A strike of legendary power",
    "type": "melee_attack",
    "target": {
      "type": "enemy"
    },
    "learned_at_level": 10,
    "target_mats": [],
    "target_maecs": [],
    "effect_algorithm": "damage = (MLA * 2.35) + (ACC * 0.5) - (target.MLD * 0.7)"
  },
  {
    "id": "G02_Paddy_11",
    "name": "Apocalypse Smash",
    "description": "Channels all strength into one hit",
    "type": "melee_attack",
    "target": {
      "type": "enemies_in_range",
      "count": 3
    },
    "learned_at_level": 11,
    "target_mats": [],
    "target_maecs": [],
    "effect_algorithm": "damage = (MLA * 2.50) + (ACC * 0.5) - (target.MLD * 0.7)"
  },
  {
    "id": "G02_Paddy_12",
    "name": "World Breaker",
    "description": "Ultimate devastating attack",
    "type": "melee_attack",
    "target": {
      "type": "enemy"
    },
    "learned_at_level": 12,
    "target_mats": [],
    "target_maecs": [],
    "effect_algorithm": "damage = (MLA * 2.65) + (ACC * 0.5) - (target.MLD * 0.7)"
  }
]