[
  {
    "id": "move_B21_1",
    "name": "Shield Bash",
    "description": "Powerful melee strike using shield",
    "type": "melee_attack",
    "target": {
      "type": "enemy"
    },
    "learned_at_level": 1,
    "effect_algorithm": "damage = (MLA * 1.5) + (ACC * 0.5) - (target.MLD * 0.8)",
    "target_mats": [
      {
        "tag": "holy",
        "multiplier": 1.5
      },
      {
        "tag": "living",
        "multiplier": 1.2
      }
    ]
  },
  {
    "id": "move_B21_2",
    "name": "Fortify",
    "description": "Increases defensive stats",
    "type": "buff",
    "target": {
      "type": "self"
    },
    "learned_at_level": 1,
    "effect_algorithm": "buff_value = (INT * 1.5) + (CRG * 0.5)"
  },
  {
    "id": "move_B21_3",
    "name": "Taunt",
    "description": "Forces enemies to target the caster",
    "type": "status_application",
    "target": {
      "type": "enemy"
    },
    "learned_at_level": 1,
    "effect_algorithm": "success_rate = (ACC + INT) / 2 - (target.EVA * 0.5)"
  },
  {
    "id": "move_B21_4",
    "name": "Defensive Stance",
    "description": "Significantly boosts defense at cost of mobility",
    "type": "buff",
    "target": {
      "type": "self"
    },
    "learned_at_level": 1,
    "effect_algorithm": "buff_value = (INT * 1.5) + (CRG * 0.5)"
  }
]