[
  {
    "id": "G22_Ciara_01",
    "name": "Sweep",
    "description": "Wide attack hitting multiple foes",
    "type": "melee_attack",
    "target": {
      "type": "enemies_in_range",
      "count": 3
    },
    "learned_at_level": 1,
    "target_mats": [],
    "target_maecs": [],
    "effect_algorithm": "damage = (MLA * 1.00) + (ACC * 0.5) - (target.MLD * 0.7)"
  },
  {
    "id": "G22_Ciara_02",
    "name": "Whirlwind",
    "description": "Spins hitting all around",
    "type": "melee_attack",
    "target": {
      "type": "enemies_in_range",
      "count": 3
    },
    "learned_at_level": 2,
    "target_mats": [],
    "target_maecs": [],
    "effect_algorithm": "damage = (MLA * 1.15) + (ACC * 0.5) - (target.MLD * 0.7)"
  },
  {
    "id": "G22_Ciara_03",
    "name": "Arc Slash",
    "description": "Slashes in a wide arc",
    "type": "melee_attack",
    "target": {
      "type": "enemies_in_range",
      "count": 3
    },
    "learned_at_level": 3,
    "target_mats": [],
    "target_maecs": [],
    "effect_algorithm": "damage = (MLA * 1.30) + (ACC * 0.5) - (target.MLD * 0.7)"
  },
  {
    "id": "G22_Ciara_04",
    "name": "Cleave",
    "description": "Cuts through multiple enemies",
    "type": "melee_attack",
    "target": {
      "type": "enemies_in_range",
      "count": 3
    },
    "learned_at_level": 4,
    "target_mats": [],
    "target_maecs": [],
    "effect_algorithm": "damage = (MLA * 1.45) + (ACC * 0.5) - (target.MLD * 0.7)"
  },
  {
    "id": "G22_Ciara_05",
    "name": "Spin Attack",
    "description": "Rotates striking all nearby",
    "type": "melee_attack",
    "target": {
      "type": "enemies_in_range",
      "count": 3
    },
    "learned_at_level": 5,
    "target_mats": [],
    "target_maecs": [],
    "effect_algorithm": "damage = (MLA * 1.60) + (ACC * 0.5) - (target.MLD * 0.7)"
  },
  {
    "id": "G22_Ciara_06",
    "name": "Chain Strike",
    "description": "Attack bounces between targets",
    "type": "melee_attack",
    "target": {
      "type": "enemies_in_range",
      "count": 3
    },
    "learned_at_level": 6,
    "target_mats": [],
    "target_maecs": [],
    "effect_algorithm": "damage = (MLA * 1.75) + (ACC * 0.5) - (target.MLD * 0.7)"
  },
  {
    "id": "G22_Ciara_07",
    "name": "Area Burst",
    "description": "Explosive damage around self",
    "type": "melee_attack",
    "target": {
      "type": "enemies_in_range",
      "count": 3
    },
    "learned_at_level": 7,
    "target_mats": [],
    "target_maecs": [],
    "effect_algorithm": "damage = (MLA * 1.90) + (ACC * 0.5) - (target.MLD * 0.7)"
  },
  {
    "id": "G22_Ciara_08",
    "name": "Multi-Strike",
    "description": "Rapid hits on multiple foes",
    "type": "melee_attack",
    "target": {
      "type": "enemies_in_range",
      "count": 3
    },
    "learned_at_level": 8,
    "target_mats": [],
    "target_maecs": [],
    "effect_algorithm": "damage = (MLA * 2.05) + (ACC * 0.5) - (target.MLD * 0.7)"
  },
  {
    "id": "G22_Ciara_09",
    "name": "Cyclone",
    "description": "Becomes a spinning vortex",
    "type": "melee_attack",
    "target": {
      "type": "enemies_in_range",
      "count": 3
    },
    "learned_at_level": 9,
    "target_mats": [],
    "target_maecs": [],
    "effect_algorithm": "damage = (MLA * 2.20) + (ACC * 0.5) - (target.MLD * 0.7)"
  },
  {
    "id": "G22_Ciara_10",
    "name": "Wave of Steel",
    "description": "Sends damaging wave outward",
    "type": "melee_attack",
    "target": {
      "type": "enemies_in_range",
      "count": 3
    },
    "learned_at_level": 10,
    "target_mats": [],
    "target_maecs": [],
    "effect_algorithm": "damage = (MLA * 2.35) + (ACC * 0.5) - (target.MLD * 0.7)"
  },
  {
    "id": "G22_Ciara_11",
    "name": "Storm of Blows",
    "description": "Rains attacks on all enemies",
    "type": "melee_attack",
    "target": {
      "type": "enemies_in_range",
      "count": 3
    },
    "learned_at_level": 11,
    "target_mats": [],
    "target_maecs": [],
    "effect_algorithm": "damage = (MLA * 2.50) + (ACC * 0.5) - (target.MLD * 0.7)"
  },
  {
    "id": "G22_Ciara_12",
    "name": "Apocalypse Wave",
    "description": "Ultimate area devastation",
    "type": "melee_attack",
    "target": {
      "type": "enemies_in_range",
      "count": 3
    },
    "learned_at_level": 12,
    "target_mats": [],
    "target_maecs": [],
    "effect_algorithm": "damage = (MLA * 2.65) + (ACC * 0.5) - (target.MLD * 0.7)"
  }
]