[
  {
    "id": "move_A30_1",
    "name": "Inspire",
    "description": "Boost ally stats",
    "type": "buff",
    "target": {
      "type": "self"
    },
    "learned_at_level": 1,
    "effect_algorithm": "buff_value = (INT * 1.5) + (CRG * 0.5)"
  },
  {
    "id": "move_A30_2",
    "name": "Rally",
    "description": "Increase team morale and stats",
    "type": "buff",
    "target": {
      "type": "self"
    },
    "learned_at_level": 1,
    "effect_algorithm": "buff_value = (INT * 1.5) + (CRG * 0.5)"
  },
  {
    "id": "move_A30_3",
    "name": "Support",
    "description": "Heal and buff an ally",
    "type": "heal",
    "target": {
      "type": "ally"
    },
    "learned_at_level": 1,
    "effect_algorithm": "healing = (MAA * 0.8) + (INT * 1.2) + (HP * 0.1)"
  },
  {
    "id": "move_A30_4",
    "name": "Encourage",
    "description": "Grant courage and stat boosts",
    "type": "buff",
    "target": {
      "type": "self"
    },
    "learned_at_level": 1,
    "effect_algorithm": "buff_value = (INT * 1.5) + (CRG * 0.5)"
  }
]